{
  "$schema": "https://json-schema.org/draft/2020-12/schema",
  "$id": "https://nauticana.github.io/charter/schema/process/gap.schema.json",
  "title": "Gap",
  "description": "Compares baseline and target elements and classifies the difference.",
  "x-charter-requirements": [
    "CHR-ARCH-004",
    "CHR-INFO-009"
  ],
  "type": "object",
  "allOf": [
    {
      "$ref": "../common.schema.json#/$defs/documentBase"
    }
  ],
  "properties": {
    "charterSpecVersion": true,
    "namespace": true,
    "id": true,
    "name": true,
    "description": true,
    "lifecycleState": true,
    "validity": true,
    "extensions": true,
    "sourceEvidence": {
      "type": "array",
      "minItems": 1,
      "uniqueItems": true,
      "items": {
        "$ref": "../common.schema.json#/$defs/idRef"
      },
      "x-charter-ref-kinds": [
        "EvidenceRecord"
      ],
      "description": "Evidence the modeled facts rest on; required when they were derived rather than entered by their accountable owner (CHR-INFO-009)."
    },
    "kind": {
      "const": "Gap"
    },
    "enterpriseId": {
      "$ref": "../common.schema.json#/$defs/idRef",
      "x-charter-ref-kinds": [
        "Enterprise"
      ]
    },
    "baselineStateId": {
      "$ref": "../common.schema.json#/$defs/idRef",
      "x-charter-ref-kinds": [
        "ArchitectureState"
      ]
    },
    "targetStateId": {
      "$ref": "../common.schema.json#/$defs/idRef",
      "x-charter-ref-kinds": [
        "ArchitectureState"
      ]
    },
    "classification": {
      "type": "string",
      "enum": [
        "missing",
        "changed",
        "retired"
      ]
    },
    "comparedElements": {
      "type": "array",
      "items": {
        "allOf": [
          {
            "$ref": "../common.schema.json#/$defs/objectRef"
          }
        ]
      }
    }
  },
  "required": [
    "kind",
    "enterpriseId",
    "baselineStateId",
    "targetStateId",
    "classification",
    "description"
  ],
  "unevaluatedProperties": false
}
